{
  "incident_id": "inc_08_cascading_timeout",
  "agent": "code_agent",
  "summary": "The changes increase the service timeout from 2 seconds to 60 seconds, disable the circuit\u2011breaker comment, and propagate the longer timeout to configuration and another module, indicating a shift to a much slower failure\u2011handling policy.",
  "evidence": [
    {
      "evidence_id": "EV-CODE-001",
      "source": "git_diff",
      "reference": "git_diff.patch:hunk 1",
      "type": "added_code",
      "excerpt": "+    # Raised timeout, circuit breaker disabled\n+    TIMEOUT_SECONDS = 60.0",
      "interpretation": "Added code raises the timeout constant to 60.0 seconds and notes that the circuit breaker is now disabled."
    },
    {
      "evidence_id": "EV-CODE-002",
      "source": "git_diff",
      "reference": "git_diff.patch:hunk 1",
      "type": "removed_code",
      "excerpt": "-    # Circuit breaker enabled, fast timeout\n-    TIMEOUT_SECONDS = 2.0",
      "interpretation": "Removed code shows the previous fast timeout of 2.0 seconds and an enabled circuit breaker."
    },
    {
      "evidence_id": "EV-CODE-003",
      "source": "config",
      "reference": "docker-compose.yml:8",
      "type": "suspicious_pattern",
      "excerpt": "      - TAX_SERVICE_TIMEOUT=60",
      "interpretation": "Docker\u2011compose sets the TAX_SERVICE_TIMEOUT environment variable to 60 seconds, matching the new code constant."
    },
    {
      "evidence_id": "EV-CODE-004",
      "source": "code",
      "reference": "service/app.py:12",
      "type": "suspicious_pattern",
      "excerpt": "    TIMEOUT_SECONDS = 60.0",
      "interpretation": "Another module defines TIMEOUT_SECONDS as 60.0, reinforcing the longer timeout across the codebase."
    }
  ]
}