{
  "incident_id": "inc_01_n_plus_one_query",
  "agent": "code_agent",
  "summary": "The recent change adds an \"items\" array to the order serialization and populates it by looping over order.items, performing a database lookup for each item's shipping address. The diff also introduces a trailing comma on the \"item_count\" line and removes the original line without the comma. The loop with a per\u2011item DB query is highlighted as a suspicious pattern that may affect performance.",
  "evidence": [
    {
      "evidence_id": "EV-CODE-001",
      "source": "git_diff",
      "reference": "git_diff.patch:hunk 1",
      "type": "added_code",
      "excerpt": "+            \"item_count\": len(order.items),\n+            \"items\": []\n+        for item in order.items:\n+            address = db_session.query_address_by_id(item.shipping_address_id)\n+            data[\"items\"].append({\"item_id\": item.id, \"shipping_to\": address.city if address else None})",
      "interpretation": "Shows the newly added code that initializes an items list and iterates over order.items, issuing a DB query for each item's shipping address."
    },
    {
      "evidence_id": "EV-CODE-002",
      "source": "git_diff",
      "reference": "git_diff.patch:hunk 1",
      "type": "removed_code",
      "excerpt": "-            \"item_count\": len(order.items)",
      "interpretation": "Indicates the original line was removed; the new version adds a trailing comma, altering syntax but not logic."
    },
    {
      "evidence_id": "EV-CODE-003",
      "source": "git_diff",
      "reference": "git_diff.patch:hunk 1",
      "type": "suspicious_pattern",
      "excerpt": "-            \"item_count\": len(order.items)\n+            \"item_count\": len(order.items),\n+            \"items\": []\n+        for item in order.items:\n+            address = db_session.query_address_by_id(item.shipping_address_id)\n+            data[\"items\"].append({\"item_id\": item.id, \"shipping_to\": address.city if address else None})",
      "interpretation": "Pattern flagged as a query inside an added loop, highlighting the new per\u2011item database access."
    },
    {
      "evidence_id": "EV-CODE-004",
      "source": "code",
      "reference": "service/app.py:40-42",
      "type": "suspicious_pattern",
      "excerpt": "        for item in order.items:\n            address = db_session.query_address_by_id(item.shipping_address_id)\n            data[\"items\"].append({\"item_id\": item.id, \"shipping_to\": address.city if address else None})",
      "interpretation": "Same loop appears in application code, confirming the per\u2011item query pattern outside of the diff context."
    }
  ]
}